{
  "$schema": "https://json-schema.org/draft/2020-12/schema",
  "title": "Test data generator configuration",
  "type": "object",
  "additionalProperties": false,
  "required": ["client"],
  "anyOf": [
    {"required": ["provider"]},
    {"required": ["provider_nppes"]},
    {"required": ["member"]},
    {"required": ["claims"]},
    {"required": ["payments"]}
  ],
  "properties": {
    "client": {"type": "string", "minLength": 1},
    "seed": {"type": "integer"},
    "output_directory": {"type": "string", "minLength": 1},
    "generation": {
      "type": "object",
      "additionalProperties": false,
      "properties": {
        "output_order": {
          "type": "object",
          "additionalProperties": false,
          "properties": {
            "headers": {"enum": ["source", "first", "last"]}
          }
        },
        "creation": {
          "type": "object",
          "additionalProperties": false,
          "properties": {
            "enabled": {"type": "boolean"},
            "directory": {"type": "string", "minLength": 1}
          }
        },
        "updates": {
          "type": "object",
          "additionalProperties": false,
          "properties": {
            "enabled": {"type": "boolean"},
            "directory": {"type": "string", "minLength": 1},
            "rule_catalog": {"type": "string", "minLength": 1},
            "invalid_values_catalog": {"type": "string", "minLength": 1},
            "matching_method": {"type": "string", "minLength": 1},
            "threshold": {"type": "number"},
            "operation": {"$ref": "#/$defs/operation"},
            "field_selection": {
              "type": "object",
              "additionalProperties": false,
              "properties": {
                "include": {"type": "array", "items": {"type": "string"}},
                "exclude": {"type": "array", "items": {"type": "string"}}
              }
            }
          }
        },
        "ingestion_dates": {
          "type": "object",
          "additionalProperties": false,
          "properties": {
            "existing": {"type": "string", "pattern": "^[0-9]{8}$"},
            "update": {"enum": ["SAME", "NEWER", "OLDER"]},
            "overrides": {
              "type": "object",
              "additionalProperties": false,
              "properties": {
                "member": {"$ref": "#/$defs/ingestion_date_override"},
                "provider": {"$ref": "#/$defs/ingestion_date_override"},
                "claims": {"$ref": "#/$defs/ingestion_date_override"},
                "claims_history": {"$ref": "#/$defs/ingestion_date_override"},
                "payments": {"$ref": "#/$defs/ingestion_date_override"}
              }
            }
          }
        }
      }
    },
    "provider": {
      "$ref": "#/$defs/provider_entity"
    },
    "provider_nppes": {
      "type": "object",
      "additionalProperties": false,
      "anyOf": [
        {"required": ["count"]},
        {"required": ["individual"]},
        {"required": ["organizational"]}
      ],
      "properties": {
        "count": {"type": "integer", "minimum": 0, "maximum": 1000000},
        "individual": {"type": "integer", "minimum": 0, "maximum": 1000000},
        "organizational": {"type": "integer", "minimum": 0, "maximum": 1000000}
      }
    },
    "member": {"$ref": "#/$defs/counted_entity"},
    "claims": {
      "type": "object",
      "minProperties": 1,
      "additionalProperties": false,
      "properties": {
        "professional": {"$ref": "#/$defs/claim_entity"},
        "institutional": {"$ref": "#/$defs/claim_entity"}
      }
    },
    "payments": {
      "type": "object",
      "minProperties": 1,
      "additionalProperties": false,
      "properties": {
        "professional": {"$ref": "#/$defs/counted_entity"},
        "institutional": {"$ref": "#/$defs/counted_entity"}
      }
    }
  },
  "$defs": {
    "operation": {
      "allOf": [
        {"$ref": "#/$defs/operation_override"},
        {"required": ["type"]}
      ]
    },
    "operation_override": {
      "type": "object",
      "additionalProperties": false,
      "properties": {
        "type": {
          "enum": ["UPDATE", "MISSING", "EMPTY", "INVALID", "WEIGHT_CHANGE", "DUPLICATE"]
        },
        "fields": {"type": "array", "items": {"type": "string"}},
        "values": {"type": "object"},
        "condition": {"enum": ["BELOW_LIMIT", "AT_LIMIT", "ABOVE_LIMIT"]},
        "selection": {
          "enum": [
            "ANY",
            "KEY",
            "REQUIRED",
            "OPTIONAL",
            "EXPLICIT",
            "HIGH_PRIORITY",
            "LOW_PRIORITY",
            "ELASTIC"
          ]
        },
        "count": {
          "oneOf": [
            {"type": "integer", "minimum": 1},
            {"const": "ALL"}
          ]
        }
      }
    },
    "provider_entity": {
      "allOf": [
        {"$ref": "#/$defs/entity"},
        {"anyOf": [{"required": ["count"]}, {"required": ["nppes"]}, {"required": ["cdf"]}]}
      ]
    },
    "ingestion_date_override": {
      "oneOf": [
        {"enum": ["SAME", "NEWER", "OLDER"]},
        {
          "type": "object",
          "additionalProperties": false,
          "properties": {
            "existing": {"type": "string", "pattern": "^[0-9]{8}$"},
            "update": {"enum": ["SAME", "NEWER", "OLDER"]}
          },
          "minProperties": 1
        }
      ]
    },
    "counted_entity": {
      "allOf": [{"$ref": "#/$defs/entity"}, {"required": ["count"]}]
    },
    "claim_entity": {
      "allOf": [{"$ref": "#/$defs/entity"}, {"required": ["count"]}]
    },
    "entity": {
      "type": "object",
      "additionalProperties": false,
      "properties": {
        "count": {"type": "integer", "minimum": 0, "maximum": 1000000},
        "nppes": {
          "type": "object",
          "additionalProperties": false,
          "anyOf": [
            {"required": ["count"]},
            {"required": ["individual"]},
            {"required": ["organizational"]}
          ],
          "properties": {
            "count": {"type": "integer", "minimum": 0, "maximum": 1000000},
            "individual": {"type": "integer", "minimum": 0, "maximum": 1000000},
            "organizational": {"type": "integer", "minimum": 0, "maximum": 1000000}
          }
        },
        "cdf": {
          "type": "object",
          "additionalProperties": false,
          "required": ["additional_count"],
          "properties": {
            "additional_count": {
              "type": "integer",
              "minimum": 0,
              "maximum": 1000000
            }
          }
        },
        "layout": {"type": "string", "minLength": 1},
        "scenario": {"type": "string", "minLength": 1},
        "method": {"type": "string", "minLength": 1},
        "fields": {"type": "array", "items": {"type": "string"}},
        "values": {"type": "object"},
        "include": {"type": "array", "items": {"type": "string"}},
        "exclude": {"type": "array", "items": {"type": "string"}},
        "condition": {"enum": ["BELOW_LIMIT", "AT_LIMIT", "ABOVE_LIMIT"]},
        "ingestion_date": {"enum": ["SAME", "NEWER", "OLDER"]},
        "mr": {
          "type": "object",
          "additionalProperties": false,
          "required": ["count"],
          "properties": {
            "count": {"type": "integer", "minimum": 0, "maximum": 1000000},
            "scenario": {"type": "string", "minLength": 1},
            "method": {"type": "string", "minLength": 1},
            "fields": {"type": "array", "items": {"type": "string"}},
            "values": {"type": "object"},
            "include": {"type": "array", "items": {"type": "string"}},
            "exclude": {"type": "array", "items": {"type": "string"}},
            "condition": {"enum": ["BELOW_LIMIT", "AT_LIMIT", "ABOVE_LIMIT"]},
            "ingestion_date": {"enum": ["SAME", "NEWER", "OLDER"]},
            "updates": {"$ref": "#/$defs/update_selection"}
          }
        },
        "output_order": {
          "type": "object",
          "additionalProperties": false,
          "properties": {
            "headers": {"enum": ["source", "first", "last"]}
          }
        },
        "updates": {"$ref": "#/$defs/update_selection"},
        "source_claims": {"type": "string", "minLength": 1},
        "scenarios": {
          "type": "object",
          "additionalProperties": {
            "type": "integer",
            "minimum": 0,
            "maximum": 1000000
          }
        },
        "frequencies": {
          "type": "object",
          "additionalProperties": false,
          "properties": {
            "1": {"type": "integer", "minimum": 0, "maximum": 1000000},
            "7": {"type": "integer", "minimum": 0, "maximum": 1000000},
            "8": {"type": "integer", "minimum": 0, "maximum": 1000000}
          }
        },
        "claim_frequency": {"enum": ["1", "7", "8"]}
      }
    },
    "update_selection": {
          "type": "object",
          "additionalProperties": false,
          "properties": {
            "fields": {"type": "array", "items": {"type": "string"}},
            "values": {"type": "object"},
            "include": {"type": "array", "items": {"type": "string"}},
            "exclude": {"type": "array", "items": {"type": "string"}},
            "matching_method": {"type": "string", "minLength": 1},
            "threshold": {"type": "number"},
            "operation": {"$ref": "#/$defs/operation_override"}
          }
    }
  }
}
