{
  "client": "chc",
  "output_directory": "./output",
  "generation": {
    "output_order": {"headers": "last"},
    "creation": {"enabled": true, "directory": "new-test-data"},
    "updates": {
      "enabled": true,
      "directory": "update-test-data",
      "rule_catalog": "src/test_data_generator/configuration/member-provider-claims-key-survivorship.json",
      "operation": {"type": "UPDATE"}
    }
  },
  "provider": {
    "nppes": {
        "count": 10
    },
    "cdf": {
      "additional_count": 90
    },
    "updates": {"operation": {"type": "UPDATE", "fields": ["CP_PROVIDER_FIRST_NAME"]}}
  },
  "member": {
    "count": 1,
    "updates": {"operation": {"type": "UPDATE", "fields": ["CM_MEMBER_FIRST_NAME"]}},
    "mr": {
      "count": 1,
      "updates": {"operation": {"type": "UPDATE", "fields": ["CM_MEMBER_MIDDLE_NAME"]}}
    }
  },
  "claims": {
    "professional": {
      "count": 7,
      "updates": {"operation": {"type": "UPDATE", "fields": ["CH_PATIENT_FIRST_NAME"]}}
    },
    "institutional": {
      "count": 7,
      "updates": {"operation": {"type": "UPDATE", "fields": ["CH_PATIENT_FIRST_NAME"]}}
    }
  },
  "payments": {
    "professional": {
      "count": 7,
      "scenarios": {
        "MATCHED": 4,
        "REVERSAL": 1,
        "REPLACEMENT": 1,
        "STALE": 1,
        "ORPHAN": 0
      }
    },
    "institutional": {
      "count": 7,
      "scenarios": {
        "MATCHED": 4,
        "REVERSAL": 1,
        "REPLACEMENT": 1,
        "STALE": 1,
        "ORPHAN": 0
      }
    }
  }
}
